{
  "version": "3.0",
  "metadata": {
    "title": "Sir James Adventures Book 003 - Chapter 01: The Enchanted Forest",
    "book": "Book003",
    "chapter": "Chapter01",
    "author": "WSP001",
    "created": "2024-09-24T20:16:00Z",
    "updated": "2024-09-24T20:16:00Z",
    "description": "Sir James and Sparky embark on their first adventure in the enchanted forest, where they must make important decisions that will shape their journey.",
    "tags": ["adventure", "friendship", "virtue", "forest", "magic"]
  },
  "characters": {
    "sir_james": {
      "name": "Sir James",
      "description": "A brave young knight with piercing blue eyes, always ready for adventure and committed to doing what's right.",
      "traits": {
        "eye_color": "blue",
        "personality": ["brave", "noble", "kind", "determined", "protective"]
      }
    },
    "sparky": {
      "name": "Sparky",
      "species": "squirrel",
      "description": "A clever and energetic squirrel who serves as Sir James's loyal companion and guide through the forest.",
      "traits": {
        "personality": ["clever", "energetic", "loyal", "curious", "resourceful"]
      }
    },
    "forest_spirit": {
      "name": "Forest Spirit",
      "description": "An ancient and wise entity that guards the secrets of the enchanted forest.",
      "traits": {
        "personality": ["wise", "mysterious", "ancient", "protective"]
      }
    }
  },
  "scenes": [
    {
      "id": "ch01_s001",
      "scene_type": "narrative",
      "title": "Into the Enchanted Forest",
      "content": "Sir James, his blue eyes gleaming with determination, stood at the edge of the Enchanted Forest alongside his faithful companion, Sparky the squirrel. The ancient trees towered above them, their branches creating a canopy that filtered the morning sunlight into dancing patterns on the forest floor. Sparky's tail twitched with excitement as he sniffed the air, detecting the magical essence that permeated this mystical realm.\n\n'Are you ready for this adventure, my friend?' Sir James asked, adjusting his sword at his side. The forest ahead seemed to whisper with secrets and promise untold wonders, but also unknown dangers.\n\nSparky chattered enthusiastically, 'The forest spirits have been waiting for us, Sir James! I can feel their presence calling to us. But we must be careful - this place tests the hearts of all who enter.'\n\nAs they took their first steps into the forest, the very air around them seemed to shimmer with magic. The path ahead split into three directions, each leading deeper into the mysterious woodland.",
      "characters": ["sir_james", "sparky"],
      "next_scene": "ch01_s002"
    },
    {
      "id": "ch01_s002",
      "scene_type": "decision",
      "title": "The Three Paths",
      "content": "Before Sir James and Sparky stretched three distinct paths, each emanating a different energy. To the left, a narrow trail wound through dense undergrowth, where they could hear the soft sounds of creatures in need. Straight ahead, a wide path led toward what appeared to be an ancient stone circle, where a mysterious figure seemed to be waiting. To the right, a steep path climbed toward a hilltop where golden light beckoned, promising treasures and glory.\n\nSparky looked up at Sir James with his bright, intelligent eyes. 'Each path will test us differently, my friend. Which way does your heart tell you to go?'\n\nSir James felt the weight of the decision. He knew that this choice would not only determine their immediate path but would also reveal something important about the kind of hero he aspired to be.",
      "characters": ["sir_james", "sparky"],
      "choices": [
        {
          "id": "help_creatures",
          "text": "Take the left path to help the creatures in need",
          "virtue": "trust",
          "next_scene": "ch01_s003",
          "consequence": "Shows trust in others and willingness to help those who cannot help themselves"
        },
        {
          "id": "approach_figure",
          "text": "Take the center path to approach the mysterious figure",
          "virtue": "wisdom",
          "next_scene": "ch01_s003",
          "consequence": "Shows wisdom in seeking knowledge and guidance from those who came before"
        },
        {
          "id": "climb_hill",
          "text": "Take the right path to climb toward the golden light",
          "virtue": "courage",
          "next_scene": "ch01_s003",
          "consequence": "Shows courage in facing challenges and reaching for greatness"
        }
      ]
    },
    {
      "id": "ch01_s003",
      "scene_type": "climax",
      "title": "The Forest Spirit's Gift",
      "content": "No matter which path Sir James chose, all three routes eventually converged at a magnificent clearing where ancient oak trees formed a perfect circle. In the center of this natural cathedral stood the Forest Spirit - a luminous being of swirling light and shadow, with eyes that held the wisdom of countless ages.\n\n'Welcome, Sir James of the blue eyes, and Sparky of the quick wit,' the Forest Spirit spoke, its voice like wind through leaves. 'I have watched your approach and seen the virtue in your heart. Each path you could have taken would have taught you something valuable, but the choice you made reveals the strength of your character.'\n\nThe Forest Spirit extended what appeared to be a hand made of starlight and morning mist. 'Because you have shown true virtue in your choice, I grant you both a gift. Sir James, your sword will now glow with inner light when you face moral challenges, helping guide you toward righteous action. And Sparky, your understanding of the forest's language will deepen, allowing you to hear the wisdom of all woodland creatures.'\n\nAs the gifts settled into their beings, Sir James felt a warm presence in his heart, while Sparky's ears perked up as he began to hear the subtle conversations of the forest around them.\n\n'Your first test is complete,' the Forest Spirit said with approval. 'But greater adventures await you both. Use your gifts wisely, and remember - true heroism lies not in the absence of fear, but in choosing to do what is right despite that fear.'\n\nWith these words, the Forest Spirit faded like morning mist, leaving Sir James and Sparky alone in the clearing, forever changed by their encounter and ready for whatever challenges lay ahead.",
      "characters": ["sir_james", "sparky", "forest_spirit"]
    }
  ]
}